"No.","Time","Source","Destination","Protocol","Length","Info"
"1","0.000000","172.20.10.2","52.57.15.81","TLSv1.2","85","Application Data"
"2","0.036037","172.20.10.2","52.57.15.81","TLSv1.2","212","Application Data"
"3","0.040854","52.57.15.81","172.20.10.2","TCP","54","8883  >  52360 [ACK] Seq=1 Ack=32 Win=117 Len=0"
"4","0.067958","52.57.15.81","172.20.10.2","TCP","54","8883  >  52356 [ACK] Seq=1 Ack=159 Win=250 Len=0"
"5","0.283586","52.57.15.81","172.20.10.2","TLSv1.2","85","Application Data"
"6","0.299002","52.57.15.81","172.20.10.2","TLSv1.2","87","Application Data"
"7","0.299002","52.57.15.81","172.20.10.2","TLSv1.2","210","Application Data"
"8","0.299084","172.20.10.2","52.57.15.81","TCP","54","52360  >  8883 [ACK] Seq=32 Ack=188 Win=1025 Len=0"
"9","0.344854","172.20.10.2","52.57.15.81","TCP","54","52356  >  8883 [ACK] Seq=159 Ack=34 Win=1025 Len=0"
"10","2.732362","172.20.10.2","52.57.15.81","TLSv1.2","212","Application Data"
"11","2.794948","52.57.15.81","172.20.10.2","TCP","54","8883  >  52356 [ACK] Seq=34 Ack=317 Win=250 Len=0"
"12","3.023697","52.57.15.81","172.20.10.2","TLSv1.2","87","Application Data"
"13","3.023697","52.57.15.81","172.20.10.2","TLSv1.2","210","Application Data"
"14","3.073728","172.20.10.2","52.57.15.81","TCP","54","52356  >  8883 [ACK] Seq=317 Ack=67 Win=1025 Len=0"
"15","3.073797","172.20.10.2","52.57.15.81","TCP","54","52360  >  8883 [ACK] Seq=32 Ack=344 Win=1024 Len=0"
"16","3.846866","172.20.10.2","52.57.15.81","TLSv1.2","212","Application Data"
"17","3.898287","52.57.15.81","172.20.10.2","TCP","54","8883  >  52356 [ACK] Seq=67 Ack=475 Win=250 Len=0"
"18","4.124792","52.57.15.81","172.20.10.2","TLSv1.2","87","Application Data"
"19","4.124792","52.57.15.81","172.20.10.2","TLSv1.2","210","Application Data"
"20","4.169261","172.20.10.2","52.57.15.81","TCP","54","52360  >  8883 [ACK] Seq=32 Ack=500 Win=1024 Len=0"
"21","4.169281","172.20.10.2","52.57.15.81","TCP","54","52356  >  8883 [ACK] Seq=475 Ack=100 Win=1025 Len=0"
"22","6.664644","172.20.10.2","52.57.15.81","TLSv1.2","212","Application Data"
"23","6.717092","52.57.15.81","172.20.10.2","TCP","54","8883  >  52356 [ACK] Seq=100 Ack=633 Win=250 Len=0"
"24","6.951581","52.57.15.81","172.20.10.2","TLSv1.2","87","Application Data"
"25","6.951581","52.57.15.81","172.20.10.2","TLSv1.2","210","Application Data"
"26","7.005912","172.20.10.2","52.57.15.81","TCP","54","52360  >  8883 [ACK] Seq=32 Ack=656 Win=1023 Len=0"
"27","7.005931","172.20.10.2","52.57.15.81","TCP","54","52356  >  8883 [ACK] Seq=633 Ack=133 Win=1025 Len=0"
"28","7.765487","172.20.10.2","52.57.15.81","TLSv1.2","212","Application Data"
"29","7.826080","52.57.15.81","172.20.10.2","TCP","54","8883  >  52356 [ACK] Seq=133 Ack=791 Win=250 Len=0"
"30","8.046379","52.57.15.81","172.20.10.2","TLSv1.2","87","Application Data"
"31","8.046379","52.57.15.81","172.20.10.2","TLSv1.2","210","Application Data"
"32","8.091253","172.20.10.2","52.57.15.81","TCP","54","52356  >  8883 [ACK] Seq=791 Ack=166 Win=1024 Len=0"
"33","8.091337","172.20.10.2","52.57.15.81","TCP","54","52360  >  8883 [ACK] Seq=32 Ack=812 Win=1023 Len=0"
"34","10.198944","172.20.10.2","52.57.15.81","TLSv1.2","212","Application Data"
"35","10.246811","52.57.15.81","172.20.10.2","TCP","54","8883  >  52356 [ACK] Seq=166 Ack=949 Win=250 Len=0"
"36","10.478043","52.57.15.81","172.20.10.2","TLSv1.2","87","Application Data"
"37","10.478043","52.57.15.81","172.20.10.2","TLSv1.2","210","Application Data"
"38","10.532783","172.20.10.2","52.57.15.81","TCP","54","52356  >  8883 [ACK] Seq=949 Ack=199 Win=1024 Len=0"
"39","10.532842","172.20.10.2","52.57.15.81","TCP","54","52360  >  8883 [ACK] Seq=32 Ack=968 Win=1028 Len=0"
"40","11.248117","172.20.10.2","52.57.15.81","TLSv1.2","212","Application Data"
"41","11.307393","52.57.15.81","172.20.10.2","TCP","54","8883  >  52356 [ACK] Seq=199 Ack=1107 Win=250 Len=0"
"42","11.522646","52.57.15.81","172.20.10.2","TLSv1.2","87","Application Data"
"43","11.525055","52.57.15.81","172.20.10.2","TLSv1.2","210","Application Data"
"44","11.567203","172.20.10.2","52.57.15.81","TCP","54","52356  >  8883 [ACK] Seq=1107 Ack=232 Win=1024 Len=0"
"45","11.567297","172.20.10.2","52.57.15.81","TCP","54","52360  >  8883 [ACK] Seq=32 Ack=1124 Win=1027 Len=0"
"46","13.346984","172.20.10.2","52.57.15.81","TLSv1.2","212","Application Data"
"47","13.381248","52.57.15.81","172.20.10.2","TCP","54","8883  >  52356 [ACK] Seq=232 Ack=1265 Win=250 Len=0"
"48","13.607895","52.57.15.81","172.20.10.2","TLSv1.2","87","Application Data"
"49","13.607895","52.57.15.81","172.20.10.2","TLSv1.2","210","Application Data"
"50","13.651698","172.20.10.2","52.57.15.81","TCP","54","52356  >  8883 [ACK] Seq=1265 Ack=265 Win=1024 Len=0"
"51","13.651771","172.20.10.2","52.57.15.81","TCP","54","52360  >  8883 [ACK] Seq=32 Ack=1280 Win=1026 Len=0"
"52","15.849817","172.20.10.2","52.57.15.81","TLSv1.2","212","Application Data"
"53","15.915011","52.57.15.81","172.20.10.2","TCP","54","8883  >  52356 [ACK] Seq=265 Ack=1423 Win=250 Len=0"
"54","16.143444","52.57.15.81","172.20.10.2","TLSv1.2","87","Application Data"
"55","16.143444","52.57.15.81","172.20.10.2","TLSv1.2","210","Application Data"
"56","16.190002","172.20.10.2","52.57.15.81","TCP","54","52356  >  8883 [ACK] Seq=1423 Ack=298 Win=1024 Len=0"
"57","16.190037","172.20.10.2","52.57.15.81","TCP","54","52360  >  8883 [ACK] Seq=32 Ack=1436 Win=1026 Len=0"
"58","18.639015","172.20.10.2","52.57.15.81","TLSv1.2","212","Application Data"
"59","18.681182","52.57.15.81","172.20.10.2","TCP","54","8883  >  52356 [ACK] Seq=298 Ack=1581 Win=250 Len=0"
"60","18.931052","52.57.15.81","172.20.10.2","TLSv1.2","87","Application Data"
"61","18.931052","52.57.15.81","172.20.10.2","TLSv1.2","210","Application Data"
"62","18.979878","172.20.10.2","52.57.15.81","TCP","54","52360  >  8883 [ACK] Seq=32 Ack=1592 Win=1025 Len=0"
"63","18.979922","172.20.10.2","52.57.15.81","TCP","54","52356  >  8883 [ACK] Seq=1581 Ack=331 Win=1024 Len=0"
"64","21.289135","172.20.10.2","52.57.15.81","TLSv1.2","212","Application Data"
"65","21.341011","52.57.15.81","172.20.10.2","TCP","54","8883  >  52356 [ACK] Seq=331 Ack=1739 Win=250 Len=0"
"66","21.565983","52.57.15.81","172.20.10.2","TLSv1.2","87","Application Data"
"67","21.565983","52.57.15.81","172.20.10.2","TLSv1.2","210","Application Data"
"68","21.614094","172.20.10.2","52.57.15.81","TCP","54","52356  >  8883 [ACK] Seq=1739 Ack=364 Win=1024 Len=0"
"69","21.614113","172.20.10.2","52.57.15.81","TCP","54","52360  >  8883 [ACK] Seq=32 Ack=1748 Win=1025 Len=0"
"70","23.011567","172.20.10.2","52.57.15.81","TLSv1.2","212","Application Data"
"71","23.050587","52.57.15.81","172.20.10.2","TCP","54","8883  >  52356 [ACK] Seq=364 Ack=1897 Win=250 Len=0"
"72","23.290938","52.57.15.81","172.20.10.2","TLSv1.2","87","Application Data"
"73","23.290938","52.57.15.81","172.20.10.2","TLSv1.2","210","Application Data"
"74","23.338025","172.20.10.2","52.57.15.81","TCP","54","52360  >  8883 [ACK] Seq=32 Ack=1904 Win=1024 Len=0"
"75","23.338097","172.20.10.2","52.57.15.81","TCP","54","52356  >  8883 [ACK] Seq=1897 Ack=397 Win=1024 Len=0"
"76","24.740364","172.20.10.2","52.57.15.81","TLSv1.2","212","Application Data"
"77","24.802097","52.57.15.81","172.20.10.2","TCP","54","8883  >  52356 [ACK] Seq=397 Ack=2055 Win=250 Len=0"
"78","25.095027","52.57.15.81","172.20.10.2","TLSv1.2","87","Application Data"
"79","25.095027","52.57.15.81","172.20.10.2","TLSv1.2","210","Application Data"
"80","25.142783","172.20.10.2","52.57.15.81","TCP","54","52356  >  8883 [ACK] Seq=2055 Ack=430 Win=1023 Len=0"
"81","25.142847","172.20.10.2","52.57.15.81","TCP","54","52360  >  8883 [ACK] Seq=32 Ack=2060 Win=1023 Len=0"
"82","25.810621","172.20.10.2","52.57.15.81","TLSv1.2","212","Application Data"
"83","25.872425","52.57.15.81","172.20.10.2","TCP","54","8883  >  52356 [ACK] Seq=430 Ack=2213 Win=250 Len=0"
"84","26.158955","52.57.15.81","172.20.10.2","TLSv1.2","87","Application Data"
"85","26.158955","52.57.15.81","172.20.10.2","TLSv1.2","210","Application Data"
"86","26.203317","172.20.10.2","52.57.15.81","TCP","54","52356  >  8883 [ACK] Seq=2213 Ack=463 Win=1023 Len=0"
"87","26.203398","172.20.10.2","52.57.15.81","TCP","54","52360  >  8883 [ACK] Seq=32 Ack=2216 Win=1023 Len=0"
"88","28.686778","172.20.10.2","52.57.15.81","TLSv1.2","212","Application Data"
"89","28.756991","52.57.15.81","172.20.10.2","TCP","54","8883  >  52356 [ACK] Seq=463 Ack=2371 Win=250 Len=0"
"90","29.031211","52.57.15.81","172.20.10.2","TLSv1.2","87","Application Data"
"91","29.031211","52.57.15.81","172.20.10.2","TLSv1.2","210","Application Data"
"92","29.077197","172.20.10.2","52.57.15.81","TCP","54","52356  >  8883 [ACK] Seq=2371 Ack=496 Win=1023 Len=0"
"93","29.077267","172.20.10.2","52.57.15.81","TCP","54","52360  >  8883 [ACK] Seq=32 Ack=2372 Win=1028 Len=0"
"94","31.680986","172.20.10.2","52.57.15.81","TLSv1.2","212","Application Data"
"95","31.772891","52.57.15.81","172.20.10.2","TCP","54","8883  >  52356 [ACK] Seq=496 Ack=2529 Win=250 Len=0"
"96","32.002741","52.57.15.81","172.20.10.2","TLSv1.2","87","Application Data"
"97","32.002741","52.57.15.81","172.20.10.2","TLSv1.2","210","Application Data"
"98","32.048494","172.20.10.2","52.57.15.81","TCP","54","52356  >  8883 [ACK] Seq=2529 Ack=529 Win=1023 Len=0"
"99","32.048531","172.20.10.2","52.57.15.81","TCP","54","52360  >  8883 [ACK] Seq=32 Ack=2528 Win=1027 Len=0"
"100","33.328682","172.20.10.2","52.57.15.81","TLSv1.2","212","Application Data"
"101","33.418666","52.57.15.81","172.20.10.2","TCP","54","8883  >  52356 [ACK] Seq=529 Ack=2687 Win=250 Len=0"
"102","33.746019","52.57.15.81","172.20.10.2","TLSv1.2","87","Application Data"
"103","33.746019","52.57.15.81","172.20.10.2","TLSv1.2","210","Application Data"
"104","33.793012","172.20.10.2","52.57.15.81","TCP","54","52356  >  8883 [ACK] Seq=2687 Ack=562 Win=1023 Len=0"
"105","33.793076","172.20.10.2","52.57.15.81","TCP","54","52360  >  8883 [ACK] Seq=32 Ack=2684 Win=1026 Len=0"
"106","35.669233","172.20.10.2","52.57.15.81","TLSv1.2","212","Application Data"
"107","35.901581","52.57.15.81","172.20.10.2","TCP","54","8883  >  52356 [ACK] Seq=562 Ack=2845 Win=250 Len=0"
"108","36.143478","52.57.15.81","172.20.10.2","TLSv1.2","87","Application Data"
"109","36.143478","52.57.15.81","172.20.10.2","TLSv1.2","210","Application Data"
"110","36.192091","172.20.10.2","52.57.15.81","TCP","54","52356  >  8883 [ACK] Seq=2845 Ack=595 Win=1023 Len=0"
"111","36.192207","172.20.10.2","52.57.15.81","TCP","54","52360  >  8883 [ACK] Seq=32 Ack=2840 Win=1026 Len=0"
"112","38.475269","172.20.10.2","52.57.15.81","TLSv1.2","212","Application Data"
"113","38.507883","52.57.15.81","172.20.10.2","TCP","54","8883  >  52356 [ACK] Seq=595 Ack=3003 Win=250 Len=0"
"114","38.743691","52.57.15.81","172.20.10.2","TLSv1.2","87","Application Data"
"115","38.743691","52.57.15.81","172.20.10.2","TLSv1.2","210","Application Data"
"116","38.786900","172.20.10.2","52.57.15.81","TCP","54","52356  >  8883 [ACK] Seq=3003 Ack=628 Win=1023 Len=0"
"117","38.786957","172.20.10.2","52.57.15.81","TCP","54","52360  >  8883 [ACK] Seq=32 Ack=2996 Win=1025 Len=0"
"118","40.318535","172.20.10.2","52.57.15.81","TLSv1.2","212","Application Data"
"119","40.382907","52.57.15.81","172.20.10.2","TCP","54","8883  >  52356 [ACK] Seq=628 Ack=3161 Win=250 Len=0"
"120","40.711826","52.57.15.81","172.20.10.2","TLSv1.2","87","Application Data"
"121","40.711826","52.57.15.81","172.20.10.2","TLSv1.2","210","Application Data"
"122","40.757591","172.20.10.2","52.57.15.81","TCP","54","52356  >  8883 [ACK] Seq=3161 Ack=661 Win=1022 Len=0"
"123","40.757653","172.20.10.2","52.57.15.81","TCP","54","52360  >  8883 [ACK] Seq=32 Ack=3152 Win=1025 Len=0"
"124","41.645236","172.20.10.2","52.57.15.81","TLSv1.2","212","Application Data"
"125","41.678258","52.57.15.81","172.20.10.2","TCP","54","8883  >  52356 [ACK] Seq=661 Ack=3319 Win=250 Len=0"
"126","41.943720","52.57.15.81","172.20.10.2","TLSv1.2","87","Application Data"
"127","41.943720","52.57.15.81","172.20.10.2","TLSv1.2","210","Application Data"
"128","41.989228","172.20.10.2","52.57.15.81","TCP","54","52360  >  8883 [ACK] Seq=32 Ack=3308 Win=1024 Len=0"
"129","41.989285","172.20.10.2","52.57.15.81","TCP","54","52356  >  8883 [ACK] Seq=3319 Ack=694 Win=1022 Len=0"
"130","44.496057","172.20.10.2","52.57.15.81","TLSv1.2","212","Application Data"
"131","44.578660","52.57.15.81","172.20.10.2","TCP","54","8883  >  52356 [ACK] Seq=694 Ack=3477 Win=250 Len=0"
"132","44.807870","52.57.15.81","172.20.10.2","TLSv1.2","87","Application Data"
"133","44.807870","52.57.15.81","172.20.10.2","TLSv1.2","210","Application Data"
"134","44.853461","172.20.10.2","52.57.15.81","TCP","54","52356  >  8883 [ACK] Seq=3477 Ack=727 Win=1022 Len=0"
"135","44.853529","172.20.10.2","52.57.15.81","TCP","54","52360  >  8883 [ACK] Seq=32 Ack=3464 Win=1023 Len=0"
"136","46.779630","172.20.10.2","52.57.15.81","TLSv1.2","212","Application Data"
"137","46.840908","52.57.15.81","172.20.10.2","TCP","54","8883  >  52356 [ACK] Seq=727 Ack=3635 Win=250 Len=0"
"138","47.157242","52.57.15.81","172.20.10.2","TLSv1.2","87","Application Data"
"139","47.157242","52.57.15.81","172.20.10.2","TLSv1.2","210","Application Data"
"140","47.202964","172.20.10.2","52.57.15.81","TCP","54","52356  >  8883 [ACK] Seq=3635 Ack=760 Win=1028 Len=0"
"141","47.203034","172.20.10.2","52.57.15.81","TCP","54","52360  >  8883 [ACK] Seq=32 Ack=3620 Win=1023 Len=0"
"142","48.653802","172.20.10.2","52.57.15.81","TLSv1.2","212","Application Data"
"143","48.697063","52.57.15.81","172.20.10.2","TCP","54","8883  >  52356 [ACK] Seq=760 Ack=3793 Win=250 Len=0"
"144","48.923883","52.57.15.81","172.20.10.2","TLSv1.2","87","Application Data"
"145","48.923883","52.57.15.81","172.20.10.2","TLSv1.2","210","Application Data"
"146","48.977225","172.20.10.2","52.57.15.81","TCP","54","52360  >  8883 [ACK] Seq=32 Ack=3776 Win=1028 Len=0"
"147","48.977302","172.20.10.2","52.57.15.81","TCP","54","52356  >  8883 [ACK] Seq=3793 Ack=793 Win=1027 Len=0"
"148","50.811447","172.20.10.2","52.57.15.81","TLSv1.2","212","Application Data"
"149","50.880874","52.57.15.81","172.20.10.2","TCP","54","8883  >  52356 [ACK] Seq=793 Ack=3951 Win=250 Len=0"
"150","51.123555","52.57.15.81","172.20.10.2","TLSv1.2","87","Application Data"
"151","51.123555","52.57.15.81","172.20.10.2","TLSv1.2","210","Application Data"
"152","51.171684","172.20.10.2","52.57.15.81","TCP","54","52360  >  8883 [ACK] Seq=32 Ack=3932 Win=1027 Len=0"
"153","51.171782","172.20.10.2","52.57.15.81","TCP","54","52356  >  8883 [ACK] Seq=3951 Ack=826 Win=1027 Len=0"
"154","52.051484","172.20.10.2","52.57.15.81","TLSv1.2","212","Application Data"
"155","52.138245","52.57.15.81","172.20.10.2","TCP","54","8883  >  52356 [ACK] Seq=826 Ack=4109 Win=250 Len=0"
"156","52.479444","52.57.15.81","172.20.10.2","TLSv1.2","87","Application Data"
"157","52.479444","52.57.15.81","172.20.10.2","TLSv1.2","210","Application Data"
"158","52.480172","172.20.10.2","52.57.15.81","TLSv1.2","85","Application Data"
"159","52.526024","172.20.10.2","52.57.15.81","TCP","54","52360  >  8883 [ACK] Seq=32 Ack=4088 Win=1026 Len=0"
"160","52.529482","52.57.15.81","172.20.10.2","TCP","54","8883  >  52356 [ACK] Seq=859 Ack=4140 Win=250 Len=0"
"161","52.764368","52.57.15.81","172.20.10.2","TLSv1.2","85","Application Data"
"162","52.811244","172.20.10.2","52.57.15.81","TCP","54","52356  >  8883 [ACK] Seq=4140 Ack=890 Win=1027 Len=0"
"163","54.182823","172.20.10.2","52.57.15.81","TLSv1.2","212","Application Data"
"164","54.259942","52.57.15.81","172.20.10.2","TCP","54","8883  >  52356 [ACK] Seq=890 Ack=4298 Win=250 Len=0"
"165","54.537835","52.57.15.81","172.20.10.2","TLSv1.2","87","Application Data"
"166","54.537835","52.57.15.81","172.20.10.2","TLSv1.2","210","Application Data"
"167","54.584107","172.20.10.2","52.57.15.81","TCP","54","52356  >  8883 [ACK] Seq=4298 Ack=923 Win=1027 Len=0"
"168","54.584145","172.20.10.2","52.57.15.81","TCP","54","52360  >  8883 [ACK] Seq=32 Ack=4244 Win=1026 Len=0"
"169","57.011069","172.20.10.2","52.57.15.81","TLSv1.2","212","Application Data"
"170","57.103313","52.57.15.81","172.20.10.2","TCP","54","8883  >  52356 [ACK] Seq=923 Ack=4456 Win=250 Len=0"
"171","57.327950","52.57.15.81","172.20.10.2","TLSv1.2","87","Application Data"
"172","57.327950","52.57.15.81","172.20.10.2","TLSv1.2","210","Application Data"
"173","57.380315","172.20.10.2","52.57.15.81","TCP","54","52356  >  8883 [ACK] Seq=4456 Ack=956 Win=1027 Len=0"
"174","57.380374","172.20.10.2","52.57.15.81","TCP","54","52360  >  8883 [ACK] Seq=32 Ack=4400 Win=1025 Len=0"
"175","58.275417","172.20.10.2","52.57.15.81","TLSv1.2","212","Application Data"
"176","58.319933","52.57.15.81","172.20.10.2","TCP","54","8883  >  52356 [ACK] Seq=956 Ack=4614 Win=250 Len=0"
"177","58.546531","52.57.15.81","172.20.10.2","TLSv1.2","87","Application Data"
"178","58.546531","52.57.15.81","172.20.10.2","TLSv1.2","210","Application Data"
"179","58.595029","172.20.10.2","52.57.15.81","TCP","54","52360  >  8883 [ACK] Seq=32 Ack=4556 Win=1025 Len=0"
"180","58.595072","172.20.10.2","52.57.15.81","TCP","54","52356  >  8883 [ACK] Seq=4614 Ack=989 Win=1027 Len=0"
"181","60.189264","172.20.10.2","52.57.15.81","TLSv1.2","212","Application Data"
"182","60.258161","52.57.15.81","172.20.10.2","TCP","54","8883  >  52356 [ACK] Seq=989 Ack=4772 Win=250 Len=0"
"183","60.559068","172.20.10.2","52.57.15.81","TLSv1.2","85","Application Data"
"184","60.575868","52.57.15.81","172.20.10.2","TLSv1.2","87","Application Data"
"185","60.575868","52.57.15.81","172.20.10.2","TLSv1.2","210","Application Data"
"186","60.601096","52.57.15.81","172.20.10.2","TCP","54","8883  >  52360 [ACK] Seq=4712 Ack=63 Win=116 Len=0"
"187","60.622201","172.20.10.2","52.57.15.81","TCP","54","52356  >  8883 [ACK] Seq=4772 Ack=1022 Win=1027 Len=0"
"188","60.622243","172.20.10.2","52.57.15.81","TCP","54","52360  >  8883 [ACK] Seq=63 Ack=4712 Win=1024 Len=0"
"189","60.838298","52.57.15.81","172.20.10.2","TLSv1.2","85","Application Data"
"190","60.890151","172.20.10.2","52.57.15.81","TCP","54","52360  >  8883 [ACK] Seq=63 Ack=4743 Win=1024 Len=0"
"191","62.792851","172.20.10.2","52.57.15.81","TLSv1.2","212","Application Data"
"192","62.875314","52.57.15.81","172.20.10.2","TCP","54","8883  >  52356 [ACK] Seq=1022 Ack=4930 Win=250 Len=0"
"193","63.137316","52.57.15.81","172.20.10.2","TLSv1.2","87","Application Data"
"194","63.137316","52.57.15.81","172.20.10.2","TLSv1.2","210","Application Data"
"195","63.183675","172.20.10.2","52.57.15.81","TCP","54","52356  >  8883 [ACK] Seq=4930 Ack=1055 Win=1026 Len=0"
"196","63.183713","172.20.10.2","52.57.15.81","TCP","54","52360  >  8883 [ACK] Seq=63 Ack=4899 Win=1023 Len=0"
"197","64.070659","172.20.10.2","52.57.15.81","TLSv1.2","212","Application Data"
"198","64.112131","52.57.15.81","172.20.10.2","TCP","54","8883  >  52356 [ACK] Seq=1055 Ack=5088 Win=250 Len=0"
"199","64.360236","52.57.15.81","172.20.10.2","TLSv1.2","87","Application Data"
"200","64.360236","52.57.15.81","172.20.10.2","TLSv1.2","210","Application Data"
"201","64.415793","172.20.10.2","52.57.15.81","TCP","54","52360  >  8883 [ACK] Seq=63 Ack=5055 Win=1023 Len=0"
"202","64.415850","172.20.10.2","52.57.15.81","TCP","54","52356  >  8883 [ACK] Seq=5088 Ack=1088 Win=1026 Len=0"
"203","67.038934","172.20.10.2","52.57.15.81","TLSv1.2","212","Application Data"
"204","67.109547","52.57.15.81","172.20.10.2","TCP","54","8883  >  52356 [ACK] Seq=1088 Ack=5246 Win=250 Len=0"
"205","67.433213","52.57.15.81","172.20.10.2","TLSv1.2","87","Application Data"
"206","67.433213","52.57.15.81","172.20.10.2","TLSv1.2","210","Application Data"
"207","67.480218","172.20.10.2","52.57.15.81","TCP","54","52356  >  8883 [ACK] Seq=5246 Ack=1121 Win=1026 Len=0"
"208","67.480278","172.20.10.2","52.57.15.81","TCP","54","52360  >  8883 [ACK] Seq=63 Ack=5211 Win=1028 Len=0"
"209","69.760722","172.20.10.2","52.57.15.81","TLSv1.2","212","Application Data"
"210","69.810281","52.57.15.81","172.20.10.2","TCP","54","8883  >  52356 [ACK] Seq=1121 Ack=5404 Win=250 Len=0"
"211","70.091237","52.57.15.81","172.20.10.2","TLSv1.2","87","Application Data"
"212","70.091237","52.57.15.81","172.20.10.2","TLSv1.2","210","Application Data"
"213","70.137476","172.20.10.2","52.57.15.81","TCP","54","52356  >  8883 [ACK] Seq=5404 Ack=1154 Win=1026 Len=0"
"214","70.137540","172.20.10.2","52.57.15.81","TCP","54","52360  >  8883 [ACK] Seq=63 Ack=5367 Win=1027 Len=0"
"215","72.216376","172.20.10.2","52.57.15.81","TLSv1.2","212","Application Data"
"216","72.278557","52.57.15.81","172.20.10.2","TCP","54","8883  >  52356 [ACK] Seq=1154 Ack=5562 Win=250 Len=0"
"217","72.556267","52.57.15.81","172.20.10.2","TLSv1.2","87","Application Data"
"218","72.556267","52.57.15.81","172.20.10.2","TLSv1.2","210","Application Data"
"219","72.603168","172.20.10.2","52.57.15.81","TCP","54","52356  >  8883 [ACK] Seq=5562 Ack=1187 Win=1026 Len=0"
"220","72.603229","172.20.10.2","52.57.15.81","TCP","54","52360  >  8883 [ACK] Seq=63 Ack=5523 Win=1026 Len=0"
"221","73.696591","172.20.10.2","52.57.15.81","TLSv1.2","212","Application Data"
"222","73.794194","52.57.15.81","172.20.10.2","TCP","54","8883  >  52356 [ACK] Seq=1187 Ack=5720 Win=250 Len=0"
"223","74.087448","52.57.15.81","172.20.10.2","TLSv1.2","87","Application Data"
"224","74.087448","52.57.15.81","172.20.10.2","TLSv1.2","210","Application Data"
"225","74.134029","172.20.10.2","52.57.15.81","TCP","54","52356  >  8883 [ACK] Seq=5720 Ack=1220 Win=1026 Len=0"
"226","74.134088","172.20.10.2","52.57.15.81","TCP","54","52360  >  8883 [ACK] Seq=63 Ack=5679 Win=1026 Len=0"
"227","76.131823","172.20.10.2","52.57.15.81","TLSv1.2","212","Application Data"
"228","76.167920","52.57.15.81","172.20.10.2","TCP","54","8883  >  52356 [ACK] Seq=1220 Ack=5878 Win=250 Len=0"
"229","76.405233","52.57.15.81","172.20.10.2","TLSv1.2","87","Application Data"
"230","76.410699","52.57.15.81","172.20.10.2","TLSv1.2","210","Application Data"
"231","76.455166","172.20.10.2","52.57.15.81","TCP","54","52356  >  8883 [ACK] Seq=5878 Ack=1253 Win=1026 Len=0"
"232","76.455227","172.20.10.2","52.57.15.81","TCP","54","52360  >  8883 [ACK] Seq=63 Ack=5835 Win=1025 Len=0"
"233","77.274893","172.20.10.2","52.57.15.81","TLSv1.2","212","Application Data"
"234","77.320859","52.57.15.81","172.20.10.2","TCP","54","8883  >  52356 [ACK] Seq=1253 Ack=6036 Win=250 Len=0"
"235","77.541912","52.57.15.81","172.20.10.2","TLSv1.2","87","Application Data"
"236","77.546946","52.57.15.81","172.20.10.2","TLSv1.2","210","Application Data"
"237","77.586676","172.20.10.2","52.57.15.81","TCP","54","52356  >  8883 [ACK] Seq=6036 Ack=1286 Win=1026 Len=0"
"238","77.586734","172.20.10.2","52.57.15.81","TCP","54","52360  >  8883 [ACK] Seq=63 Ack=5991 Win=1025 Len=0"
"239","78.522387","172.20.10.2","52.57.15.81","TLSv1.2","212","Application Data"
"240","78.588360","52.57.15.81","172.20.10.2","TCP","54","8883  >  52356 [ACK] Seq=1286 Ack=6194 Win=250 Len=0"
"241","78.899247","52.57.15.81","172.20.10.2","TLSv1.2","87","Application Data"
"242","78.899247","52.57.15.81","172.20.10.2","TLSv1.2","210","Application Data"
"243","78.945477","172.20.10.2","52.57.15.81","TCP","54","52356  >  8883 [ACK] Seq=6194 Ack=1319 Win=1025 Len=0"
"244","78.945535","172.20.10.2","52.57.15.81","TCP","54","52360  >  8883 [ACK] Seq=63 Ack=6147 Win=1024 Len=0"
"245","79.839820","172.20.10.2","52.57.15.81","TLSv1.2","212","Application Data"
"246","79.871523","52.57.15.81","172.20.10.2","TCP","54","8883  >  52356 [ACK] Seq=1319 Ack=6352 Win=250 Len=0"
"247","80.136233","52.57.15.81","172.20.10.2","TLSv1.2","87","Application Data"
"248","80.136233","52.57.15.81","172.20.10.2","TLSv1.2","210","Application Data"
"249","80.181705","172.20.10.2","52.57.15.81","TCP","54","52356  >  8883 [ACK] Seq=6352 Ack=1352 Win=1025 Len=0"
"250","80.181806","172.20.10.2","52.57.15.81","TCP","54","52360  >  8883 [ACK] Seq=63 Ack=6303 Win=1023 Len=0"
"251","81.441489","172.20.10.2","52.57.15.81","TLSv1.2","212","Application Data"
"252","81.507996","52.57.15.81","172.20.10.2","TCP","54","8883  >  52356 [ACK] Seq=1352 Ack=6510 Win=250 Len=0"
"253","81.742868","52.57.15.81","172.20.10.2","TLSv1.2","87","Application Data"
"254","81.742868","52.57.15.81","172.20.10.2","TLSv1.2","210","Application Data"
"255","81.788267","172.20.10.2","52.57.15.81","TCP","54","52356  >  8883 [ACK] Seq=6510 Ack=1385 Win=1025 Len=0"
"256","81.788332","172.20.10.2","52.57.15.81","TCP","54","52360  >  8883 [ACK] Seq=63 Ack=6459 Win=1023 Len=0"
"257","83.957635","172.20.10.2","52.57.15.81","TLSv1.2","212","Application Data"
"258","84.002460","52.57.15.81","172.20.10.2","TCP","54","8883  >  52356 [ACK] Seq=1385 Ack=6668 Win=250 Len=0"
"259","84.223280","52.57.15.81","172.20.10.2","TLSv1.2","87","Application Data"
"260","84.229074","52.57.15.81","172.20.10.2","TLSv1.2","210","Application Data"
"261","84.268474","172.20.10.2","52.57.15.81","TCP","54","52356  >  8883 [ACK] Seq=6668 Ack=1418 Win=1025 Len=0"
"262","84.268538","172.20.10.2","52.57.15.81","TCP","54","52360  >  8883 [ACK] Seq=63 Ack=6615 Win=1028 Len=0"
"263","84.978130","172.20.10.2","52.57.15.81","TLSv1.2","212","Application Data"
"264","85.047155","52.57.15.81","172.20.10.2","TCP","54","8883  >  52356 [ACK] Seq=1418 Ack=6826 Win=250 Len=0"
"265","85.268015","52.57.15.81","172.20.10.2","TLSv1.2","87","Application Data"
"266","85.273091","52.57.15.81","172.20.10.2","TLSv1.2","210","Application Data"
"267","85.316631","172.20.10.2","52.57.15.81","TCP","54","52356  >  8883 [ACK] Seq=6826 Ack=1451 Win=1025 Len=0"
"268","85.316691","172.20.10.2","52.57.15.81","TCP","54","52360  >  8883 [ACK] Seq=63 Ack=6771 Win=1027 Len=0"
"269","87.432282","172.20.10.2","52.57.15.81","TLSv1.2","212","Application Data"
"270","87.461724","52.57.15.81","172.20.10.2","TCP","54","8883  >  52356 [ACK] Seq=1451 Ack=6984 Win=250 Len=0"
"271","87.703313","52.57.15.81","172.20.10.2","TLSv1.2","87","Application Data"
"272","87.703313","52.57.15.81","172.20.10.2","TLSv1.2","210","Application Data"
"273","87.749393","172.20.10.2","52.57.15.81","TCP","54","52360  >  8883 [ACK] Seq=63 Ack=6927 Win=1026 Len=0"
"274","87.749453","172.20.10.2","52.57.15.81","TCP","54","52356  >  8883 [ACK] Seq=6984 Ack=1484 Win=1025 Len=0"
"275","90.055586","172.20.10.2","52.57.15.81","TLSv1.2","212","Application Data"
"276","90.106966","52.57.15.81","172.20.10.2","TCP","54","8883  >  52356 [ACK] Seq=1484 Ack=7142 Win=250 Len=0"
"277","90.357582","52.57.15.81","172.20.10.2","TLSv1.2","87","Application Data"
"278","90.357582","52.57.15.81","172.20.10.2","TLSv1.2","210","Application Data"
"279","90.400761","172.20.10.2","52.57.15.81","TCP","54","52356  >  8883 [ACK] Seq=7142 Ack=1517 Win=1025 Len=0"
"280","90.400820","172.20.10.2","52.57.15.81","TCP","54","52360  >  8883 [ACK] Seq=63 Ack=7083 Win=1026 Len=0"
"281","92.339395","172.20.10.2","52.57.15.81","TLSv1.2","212","Application Data"
"282","92.409906","52.57.15.81","172.20.10.2","TCP","54","8883  >  52356 [ACK] Seq=1517 Ack=7300 Win=250 Len=0"
"283","92.726507","52.57.15.81","172.20.10.2","TLSv1.2","87","Application Data"
"284","92.726507","52.57.15.81","172.20.10.2","TLSv1.2","210","Application Data"
"285","92.772158","172.20.10.2","52.57.15.81","TCP","54","52356  >  8883 [ACK] Seq=7300 Ack=1550 Win=1025 Len=0"
"286","92.772205","172.20.10.2","52.57.15.81","TCP","54","52360  >  8883 [ACK] Seq=63 Ack=7239 Win=1025 Len=0"
"287","94.969002","172.20.10.2","52.57.15.81","TLSv1.2","212","Application Data"
"288","95.070853","52.57.15.81","172.20.10.2","TCP","54","8883  >  52356 [ACK] Seq=1550 Ack=7458 Win=250 Len=0"
"289","95.303085","52.57.15.81","172.20.10.2","TLSv1.2","87","Application Data"
"290","95.303085","52.57.15.81","172.20.10.2","TLSv1.2","210","Application Data"
"291","95.347792","172.20.10.2","52.57.15.81","TCP","54","52356  >  8883 [ACK] Seq=7458 Ack=1583 Win=1024 Len=0"
"292","95.347855","172.20.10.2","52.57.15.81","TCP","54","52360  >  8883 [ACK] Seq=63 Ack=7395 Win=1025 Len=0"
"293","97.733724","172.20.10.2","52.57.15.81","TLSv1.2","212","Application Data"
"294","97.769732","52.57.15.81","172.20.10.2","TCP","54","8883  >  52356 [ACK] Seq=1583 Ack=7616 Win=250 Len=0"
"295","98.048058","52.57.15.81","172.20.10.2","TLSv1.2","87","Application Data"
"296","98.048058","52.57.15.81","172.20.10.2","TLSv1.2","210","Application Data"
"297","98.094856","172.20.10.2","52.57.15.81","TCP","54","52356  >  8883 [ACK] Seq=7616 Ack=1616 Win=1024 Len=0"
"298","98.094903","172.20.10.2","52.57.15.81","TCP","54","52360  >  8883 [ACK] Seq=63 Ack=7551 Win=1024 Len=0"
"299","99.073790","172.20.10.2","52.57.15.81","TLSv1.2","212","Application Data"
"300","99.109339","52.57.15.81","172.20.10.2","TCP","54","8883  >  52356 [ACK] Seq=1616 Ack=7774 Win=250 Len=0"
"301","99.335265","52.57.15.81","172.20.10.2","TLSv1.2","87","Application Data"
"302","99.335265","52.57.15.81","172.20.10.2","TLSv1.2","210","Application Data"
"303","99.386701","172.20.10.2","52.57.15.81","TCP","54","52360  >  8883 [ACK] Seq=63 Ack=7707 Win=1023 Len=0"
"304","99.386808","172.20.10.2","52.57.15.81","TCP","54","52356  >  8883 [ACK] Seq=7774 Ack=1649 Win=1024 Len=0"
"305","101.500423","172.20.10.2","52.57.15.81","TLSv1.2","212","Application Data"
"306","101.575601","52.57.15.81","172.20.10.2","TCP","54","8883  >  52356 [ACK] Seq=1649 Ack=7932 Win=250 Len=0"
"307","101.846561","52.57.15.81","172.20.10.2","TLSv1.2","87","Application Data"
"308","101.846561","52.57.15.81","172.20.10.2","TLSv1.2","210","Application Data"
"309","101.892508","172.20.10.2","52.57.15.81","TCP","54","52356  >  8883 [ACK] Seq=7932 Ack=1682 Win=1024 Len=0"
"310","101.892569","172.20.10.2","52.57.15.81","TCP","54","52360  >  8883 [ACK] Seq=63 Ack=7863 Win=1023 Len=0"
"311","103.442601","172.20.10.2","52.57.15.81","TLSv1.2","212","Application Data"
"312","103.479242","52.57.15.81","172.20.10.2","TCP","54","8883  >  52356 [ACK] Seq=1682 Ack=8090 Win=250 Len=0"
"313","103.705300","52.57.15.81","172.20.10.2","TLSv1.2","87","Application Data"
"314","103.705300","52.57.15.81","172.20.10.2","TLSv1.2","210","Application Data"
"315","103.757386","172.20.10.2","52.57.15.81","TCP","54","52360  >  8883 [ACK] Seq=63 Ack=8019 Win=1028 Len=0"
"316","103.757454","172.20.10.2","52.57.15.81","TCP","54","52356  >  8883 [ACK] Seq=8090 Ack=1715 Win=1024 Len=0"
"317","105.458078","172.20.10.2","52.57.15.81","TLSv1.2","212","Application Data"
"318","105.527854","52.57.15.81","172.20.10.2","TCP","54","8883  >  52356 [ACK] Seq=1715 Ack=8248 Win=250 Len=0"
"319","105.822348","52.57.15.81","172.20.10.2","TLSv1.2","87","Application Data"
"320","105.822348","52.57.15.81","172.20.10.2","TLSv1.2","210","Application Data"
"321","105.868584","172.20.10.2","52.57.15.81","TCP","54","52356  >  8883 [ACK] Seq=8248 Ack=1748 Win=1024 Len=0"
"322","105.868647","172.20.10.2","52.57.15.81","TCP","54","52360  >  8883 [ACK] Seq=63 Ack=8175 Win=1027 Len=0"
"323","108.373019","172.20.10.2","52.57.15.81","TLSv1.2","212","Application Data"
"324","108.429844","52.57.15.81","172.20.10.2","TCP","54","8883  >  52356 [ACK] Seq=1748 Ack=8406 Win=250 Len=0"
"325","108.662665","52.57.15.81","172.20.10.2","TLSv1.2","87","Application Data"
"326","108.662665","52.57.15.81","172.20.10.2","TLSv1.2","210","Application Data"
"327","108.706970","172.20.10.2","52.57.15.81","TCP","54","52356  >  8883 [ACK] Seq=8406 Ack=1781 Win=1024 Len=0"
"328","108.707032","172.20.10.2","52.57.15.81","TCP","54","52360  >  8883 [ACK] Seq=63 Ack=8331 Win=1026 Len=0"
"329","109.989189","172.20.10.2","52.57.15.81","TLSv1.2","212","Application Data"
"330","110.061858","52.57.15.81","172.20.10.2","TCP","54","8883  >  52356 [ACK] Seq=1781 Ack=8564 Win=250 Len=0"
"331","110.340524","52.57.15.81","172.20.10.2","TLSv1.2","87","Application Data"
"332","110.340524","52.57.15.81","172.20.10.2","TLSv1.2","210","Application Data"
"333","110.386438","172.20.10.2","52.57.15.81","TCP","54","52356  >  8883 [ACK] Seq=8564 Ack=1814 Win=1024 Len=0"
"334","110.386509","172.20.10.2","52.57.15.81","TCP","54","52360  >  8883 [ACK] Seq=63 Ack=8487 Win=1026 Len=0"
"335","111.992073","172.20.10.2","52.57.15.81","TLSv1.2","212","Application Data"
"336","112.063107","52.57.15.81","172.20.10.2","TCP","54","8883  >  52356 [ACK] Seq=1814 Ack=8722 Win=250 Len=0"
"337","112.388165","52.57.15.81","172.20.10.2","TLSv1.2","87","Application Data"
"338","112.388165","52.57.15.81","172.20.10.2","TLSv1.2","210","Application Data"
"339","112.433497","172.20.10.2","52.57.15.81","TCP","54","52356  >  8883 [ACK] Seq=8722 Ack=1847 Win=1023 Len=0"
"340","112.433561","172.20.10.2","52.57.15.81","TCP","54","52360  >  8883 [ACK] Seq=63 Ack=8643 Win=1025 Len=0"
"341","113.400331","172.20.10.2","52.57.15.81","TLSv1.2","85","Application Data"
"342","113.461747","52.57.15.81","172.20.10.2","TCP","54","8883  >  52356 [ACK] Seq=1847 Ack=8753 Win=250 Len=0"
"343","113.682138","52.57.15.81","172.20.10.2","TLSv1.2","85","Application Data"
"344","113.731490","172.20.10.2","52.57.15.81","TCP","54","52356  >  8883 [ACK] Seq=8753 Ack=1878 Win=1023 Len=0"
"345","113.815352","172.20.10.2","52.57.15.81","TLSv1.2","212","Application Data"
"346","113.849926","52.57.15.81","172.20.10.2","TCP","54","8883  >  52356 [ACK] Seq=1878 Ack=8911 Win=250 Len=0"
"347","114.128664","52.57.15.81","172.20.10.2","TLSv1.2","87","Application Data"
"348","114.128664","52.57.15.81","172.20.10.2","TLSv1.2","210","Application Data"
"349","114.174590","172.20.10.2","52.57.15.81","TCP","54","52356  >  8883 [ACK] Seq=8911 Ack=1911 Win=1023 Len=0"
"350","114.174655","172.20.10.2","52.57.15.81","TCP","54","52360  >  8883 [ACK] Seq=63 Ack=8799 Win=1025 Len=0"
"351","116.220185","172.20.10.2","52.57.15.81","TLSv1.2","212","Application Data"
"352","116.273452","52.57.15.81","172.20.10.2","TCP","54","8883  >  52356 [ACK] Seq=1911 Ack=9069 Win=250 Len=0"
"353","116.497634","52.57.15.81","172.20.10.2","TLSv1.2","87","Application Data"
"354","116.497634","52.57.15.81","172.20.10.2","TLSv1.2","210","Application Data"
"355","116.544517","172.20.10.2","52.57.15.81","TCP","54","52360  >  8883 [ACK] Seq=63 Ack=8955 Win=1024 Len=0"
"356","116.544574","172.20.10.2","52.57.15.81","TCP","54","52356  >  8883 [ACK] Seq=9069 Ack=1944 Win=1023 Len=0"
"357","118.052883","172.20.10.2","52.57.15.81","TLSv1.2","212","Application Data"
"358","118.129831","52.57.15.81","172.20.10.2","TCP","54","8883  >  52356 [ACK] Seq=1944 Ack=9227 Win=250 Len=0"
"359","118.363364","52.57.15.81","172.20.10.2","TLSv1.2","87","Application Data"
"360","118.363364","52.57.15.81","172.20.10.2","TLSv1.2","210","Application Data"
"361","118.406489","172.20.10.2","52.57.15.81","TCP","54","52356  >  8883 [ACK] Seq=9227 Ack=1977 Win=1023 Len=0"
"362","118.406541","172.20.10.2","52.57.15.81","TCP","54","52360  >  8883 [ACK] Seq=63 Ack=9111 Win=1023 Len=0"
"363","119.634957","172.20.10.2","52.57.15.81","TLSv1.2","212","Application Data"
"364","119.687015","52.57.15.81","172.20.10.2","TCP","54","8883  >  52356 [ACK] Seq=1977 Ack=9385 Win=250 Len=0"
"365","119.961348","52.57.15.81","172.20.10.2","TLSv1.2","87","Application Data"
"366","119.961348","52.57.15.81","172.20.10.2","TLSv1.2","210","Application Data"
"367","120.007816","172.20.10.2","52.57.15.81","TCP","54","52356  >  8883 [ACK] Seq=9385 Ack=2010 Win=1023 Len=0"
"368","120.007883","172.20.10.2","52.57.15.81","TCP","54","52360  >  8883 [ACK] Seq=63 Ack=9267 Win=1023 Len=0"
"369","120.977212","172.20.10.2","52.57.15.81","TLSv1.2","85","Application Data"
"370","121.022047","52.57.15.81","172.20.10.2","TCP","54","8883  >  52360 [ACK] Seq=9267 Ack=94 Win=117 Len=0"
"371","121.076241","172.20.10.2","52.57.15.81","TLSv1.2","212","Application Data"
"372","121.118777","52.57.15.81","172.20.10.2","TCP","54","8883  >  52356 [ACK] Seq=2010 Ack=9543 Win=250 Len=0"
"373","121.257421","52.57.15.81","172.20.10.2","TLSv1.2","85","Application Data"
"374","121.308681","172.20.10.2","52.57.15.81","TCP","54","52360  >  8883 [ACK] Seq=94 Ack=9298 Win=1023 Len=0"
"375","121.346088","52.57.15.81","172.20.10.2","TLSv1.2","87","Application Data"
"376","121.346088","52.57.15.81","172.20.10.2","TLSv1.2","210","Application Data"
"377","121.386847","172.20.10.2","52.57.15.81","TCP","54","52360  >  8883 [ACK] Seq=94 Ack=9454 Win=1028 Len=0"
"378","121.386912","172.20.10.2","52.57.15.81","TCP","54","52356  >  8883 [ACK] Seq=9543 Ack=2043 Win=1023 Len=0"
"379","123.366970","172.20.10.2","52.57.15.81","TLSv1.2","212","Application Data"
"380","123.439552","52.57.15.81","172.20.10.2","TCP","54","8883  >  52356 [ACK] Seq=2043 Ack=9701 Win=250 Len=0"
"381","123.750186","52.57.15.81","172.20.10.2","TLSv1.2","87","Application Data"
"382","123.750186","52.57.15.81","172.20.10.2","TLSv1.2","210","Application Data"
"383","123.799033","172.20.10.2","52.57.15.81","TCP","54","52356  >  8883 [ACK] Seq=9701 Ack=2076 Win=1022 Len=0"
"384","123.799150","172.20.10.2","52.57.15.81","TCP","54","52360  >  8883 [ACK] Seq=94 Ack=9610 Win=1027 Len=0"
"385","124.535655","172.20.10.2","52.57.15.81","TLSv1.2","212","Application Data"
"386","124.567070","52.57.15.81","172.20.10.2","TCP","54","8883  >  52356 [ACK] Seq=2076 Ack=9859 Win=250 Len=0"
"387","124.801134","52.57.15.81","172.20.10.2","TLSv1.2","87","Application Data"
"388","124.801134","52.57.15.81","172.20.10.2","TLSv1.2","210","Application Data"
"389","124.842006","172.20.10.2","52.57.15.81","TCP","54","52360  >  8883 [ACK] Seq=94 Ack=9766 Win=1026 Len=0"
"390","124.842070","172.20.10.2","52.57.15.81","TCP","54","52356  >  8883 [ACK] Seq=9859 Ack=2109 Win=1022 Len=0"
"391","126.434052","172.20.10.2","52.57.15.81","TLSv1.2","212","Application Data"
"392","126.498924","52.57.15.81","172.20.10.2","TCP","54","8883  >  52356 [ACK] Seq=2109 Ack=10017 Win=250 Len=0"
"393","126.817226","52.57.15.81","172.20.10.2","TLSv1.2","87","Application Data"
"394","126.817226","52.57.15.81","172.20.10.2","TLSv1.2","210","Application Data"
"395","126.864860","172.20.10.2","52.57.15.81","TCP","54","52356  >  8883 [ACK] Seq=10017 Ack=2142 Win=1022 Len=0"
"396","126.864920","172.20.10.2","52.57.15.81","TCP","54","52360  >  8883 [ACK] Seq=94 Ack=9922 Win=1026 Len=0"
"397","128.167979","172.20.10.2","52.57.15.81","TLSv1.2","212","Application Data"
"398","128.230757","52.57.15.81","172.20.10.2","TCP","54","8883  >  52356 [ACK] Seq=2142 Ack=10175 Win=250 Len=0"
"399","128.564890","52.57.15.81","172.20.10.2","TLSv1.2","87","Application Data"
"400","128.564890","52.57.15.81","172.20.10.2","TLSv1.2","210","Application Data"
"401","128.604586","172.20.10.2","52.57.15.81","TCP","54","52356  >  8883 [ACK] Seq=10175 Ack=2175 Win=1028 Len=0"
"402","128.604635","172.20.10.2","52.57.15.81","TCP","54","52360  >  8883 [ACK] Seq=94 Ack=10078 Win=1025 Len=0"
"403","130.828794","172.20.10.2","52.57.15.81","TLSv1.2","212","Application Data"
"404","130.857849","52.57.15.81","172.20.10.2","TCP","54","8883  >  52356 [ACK] Seq=2175 Ack=10333 Win=250 Len=0"
"405","131.080800","52.57.15.81","172.20.10.2","TLSv1.2","87","Application Data"
"406","131.080800","52.57.15.81","172.20.10.2","TLSv1.2","210","Application Data"
"407","131.130857","172.20.10.2","52.57.15.81","TCP","54","52360  >  8883 [ACK] Seq=94 Ack=10234 Win=1025 Len=0"
"408","131.130910","172.20.10.2","52.57.15.81","TCP","54","52356  >  8883 [ACK] Seq=10333 Ack=2208 Win=1027 Len=0"
"409","132.990626","172.20.10.2","52.57.15.81","TLSv1.2","212","Application Data"
"410","133.058815","52.57.15.81","172.20.10.2","TCP","54","8883  >  52356 [ACK] Seq=2208 Ack=10491 Win=250 Len=0"
"411","133.883272","52.57.15.81","172.20.10.2","TLSv1.2","87","Application Data"
"412","133.883272","52.57.15.81","172.20.10.2","TLSv1.2","210","Application Data"
"413","133.932539","172.20.10.2","52.57.15.81","TCP","54","52356  >  8883 [ACK] Seq=10491 Ack=2241 Win=1027 Len=0"
"414","133.932601","172.20.10.2","52.57.15.81","TCP","54","52360  >  8883 [ACK] Seq=94 Ack=10390 Win=1024 Len=0"
"415","134.242100","172.20.10.2","52.57.15.81","TLSv1.2","212","Application Data"
"416","134.409489","52.57.15.81","172.20.10.2","TCP","54","8883  >  52356 [ACK] Seq=2241 Ack=10649 Win=250 Len=0"
"417","134.501815","52.57.15.81","172.20.10.2","TLSv1.2","87","Application Data"
"418","134.501815","52.57.15.81","172.20.10.2","TLSv1.2","210","Application Data"
"419","134.549271","172.20.10.2","52.57.15.81","TCP","54","52360  >  8883 [ACK] Seq=94 Ack=10546 Win=1023 Len=0"
"420","134.549335","172.20.10.2","52.57.15.81","TCP","54","52356  >  8883 [ACK] Seq=10649 Ack=2274 Win=1027 Len=0"
